{
  "contractVersion": "1",
  "id": "MODEL_06",
  "name": "Biblioteca",
  "version": "1.0.0",
  "packages": [
    {
      "id": "PKG_06",
      "name": "biblioteca"
    }
  ],
  "classes": [
    {
      "id": "CLS_50",
      "name": "Libro",
      "packageId": "PKG_06",
      "isAbstract": false,
      "description": "Entidad que representa un libro del catálogo.",
      "attributes": [
        {
          "id": "ATTR_50",
          "name": "titulo",
          "type": "String",
          "nullable": false,
          "multiplicity": "1"
        },
        {
          "id": "ATTR_51",
          "name": "anioPublicacion",
          "type": "Integer",
          "nullable": true,
          "multiplicity": "0..1"
        }
      ]
    },
    {
      "id": "CLS_51",
      "name": "Autor",
      "packageId": "PKG_06",
      "isAbstract": false,
      "attributes": [
        {
          "id": "ATTR_52",
          "name": "nombre",
          "type": "String",
          "nullable": false,
          "multiplicity": "1"
        }
      ]
    }
  ],
  "associations": [
    {
      "id": "ASSOC_06",
      "name": "escritoPor",
      "sourceClassId": "CLS_50",
      "targetClassId": "CLS_51",
      "sourceMultiplicity": "0..*",
      "targetMultiplicity": "1..*",
      "navigability": "bidirectional"
    }
  ]
}
