{
  "contractVersion": "1",
  "id": "3f2504e0-4f89-11d3-9a0c-0305e82c3301",
  "name": "Biblioteca",
  "version": "1.0.0",
  "packages": [
    {
      "id": "pkg-01",
      "name": "biblioteca"
    }
  ],
  "classes": [
    {
      "id": "cls-01",
      "name": "Libro",
      "packageId": "pkg-01",
      "isAbstract": false,
      "attributes": [
        {
          "id": "attr-01",
          "name": "titulo",
          "type": "String",
          "nullable": false,
          "multiplicity": "1"
        },
        {
          "id": "attr-02",
          "name": "isbn",
          "type": "String",
          "nullable": false,
          "multiplicity": "1"
        },
        {
          "id": "attr-03",
          "name": "fechaPublicacion",
          "type": "Date",
          "nullable": true,
          "multiplicity": "0..1"
        }
      ]
    },
    {
      "id": "cls-02",
      "name": "Autor",
      "packageId": "pkg-01",
      "isAbstract": false,
      "attributes": [
        {
          "id": "attr-04",
          "name": "nombre",
          "type": "String",
          "nullable": false,
          "multiplicity": "1"
        }
      ]
    }
  ],
  "associations": [
    {
      "id": "assoc-01",
      "name": "escritoPor",
      "sourceClassId": "cls-01",
      "targetClassId": "cls-02",
      "sourceMultiplicity": "0..*",
      "targetMultiplicity": "1..*",
      "navigability": "bidirectional"
    }
  ]
}
